제품명,기종,재질,스트랩 규격,체결 형태,색상,이미지,원본탭
듀오 매트 그레인 마그넷 링크 실리콘 스트랩 14mm,공용,실리콘,14mm,마그네틱,,,기종별 일반형 14mm
오리진 실리콘 스트랩 18mm,공용,패브릭,18mm,벨크로,,,기종별 일반형 18mm
새들 스티치 포우 레더 스트랩 18mm,공용,가죽,18mm,버클,,,기종별 일반형 18mm
모노 스트랩 (스포츠루프),공용,패브릭,20mm,벨크로,,,기종별 일반형 20mm
풀탭 스포츠루프 스트랩,공용,패브릭,20mm,벨크로,,,기종별 일반형 20mm
마일드 트레일 루프 스트랩,공용,패브릭,20mm,루프,,,기종별 일반형 20mm
후크형 트레일 패브릭 나일론 스트랩,공용,패브릭,20mm,,,,기종별 일반형 20mm
알파인 스트랩,공용,패브릭,20mm,,,,기종별 일반형 20mm
후크 투톤 패브릭 나일론 스트랩 (*구 알파인 루프 스트랩 리뉴얼 형),공용,패브릭,20mm,루프,,,기종별 일반형 20mm
브레이드 스트랩 ( 기존 25 컬러),공용,패브릭,20mm,브레이드,,,기종별 일반형 20mm
브레이드 스트랩 ( 신규 12 컬러),공용,패브릭,20mm,브레이드,,,기종별 일반형 20mm
마그넷 루프 *플라스틱,공용,패브릭,20mm,마그네틱,,,기종별 일반형 20mm
(버클형)마그넷 브레이드 스트랩,공용,패브릭,20mm,마그네틱,,,기종별 일반형 20mm
버클형 파스텔 스트랩,공용,패브릭,20mm,버클,,,기종별 일반형 20mm
버클 브레이드 스트랩,공용,패브릭,20mm,브레이드,,,기종별 일반형 20mm
니트 스트랩,공용,패브릭,20mm,,,,기종별 일반형 20mm
프리미엄 마그네틱 버클형 브레이드 스트랩,공용,패브릭,20mm,마그네틱,,,기종별 일반형 20mm
나토 밴드,공용,패브릭,20mm,나토,,,기종별 일반형 20mm
베이직 실리콘 스트랩,공용,실리콘,20mm,,,,기종별 일반형 20mm
버튼 베이직 실리콘 스트랩,공용,실리콘,20mm,버튼,,,기종별 일반형 20mm
스포티 실리콘 스트랩,공용,실리콘,20mm,,,,기종별 일반형 20mm
버튼형 스포티 스트랩,공용,실리콘,20mm,버튼,,,기종별 일반형 20mm
어반 실리콘 스트랩,공용,실리콘,20mm,,,,기종별 일반형 20mm
디버클 마그네틱 실리콘 스트랩,공용,실리콘,20mm,마그네틱,,,기종별 일반형 20mm
소프트 마그넷 링크 실리콘 스트랩,공용,실리콘,20mm,마그네틱,,,기종별 일반형 20mm
와플 패턴 실리콘 스트랩,공용,실리콘,20mm,,,,기종별 일반형 20mm
스트릿 엣지 실리콘 스트랩,공용,실리콘,20mm,,,,기종별 일반형 20mm
디버클 블랜드 투톤 실리콘 스트랩,공용,실리콘,20mm,마그네틱,,,기종별 일반형 20mm
디버틀 오션 실리콘 스트랩,공용,실리콘,20mm,,,,기종별 일반형 20mm
메탈 스트랩,공용,메탈,20mm,,,,기종별 일반형 20mm
버클형 슬림 메탈 밀레니즈 스트랩,공용,메탈,20mm,버클,,,기종별 일반형 20mm
일반형 디버클 마그네틱 메탈 스트랩,공용,메탈,20mm,마그네틱,"블랙,실버,골드,로즈골드,로즈핑크,크림",,기종별 일반형 20mm
스틸 스트랩,공용,메탈,20mm,,,,기종별 일반형 20mm
슬림 스틸 스트랩,공용,메탈,20mm,,,images/03_32.jpg,기종별 일반형 20mm
쥬빌레 메탈 스트랩,공용,메탈,20mm,,,,기종별 일반형 20mm
큐빅 글리터 메탈 스트랩,공용,메탈,20mm,,,,기종별 일반형 20mm
체인 큐빅 스트랩,공용,메탈,20mm,,,,기종별 일반형 20mm
체인 스틸 스트랩,공용,메탈,20mm,,,,기종별 일반형 20mm
헤링본 큐빅 메탈 스트랩,공용,메탈,20mm,,,,기종별 일반형 20mm
샤인 큐빅 메탈 스트랩,공용,메탈,20mm,,,images/03_38.jpg,기종별 일반형 20mm
샤인 큐빅 슬림 브레이슬릿 스트랩,공용,메탈,20mm,,,,기종별 일반형 20mm
샤인 큐빅 트리플 메탈 스트랩,공용,메탈,20mm,,,,기종별 일반형 20mm
더블 라인 큐빅 메탈 스트랩,공용,메탈,20mm,,,,기종별 일반형 20mm
스퀘어 체인 메탈 스트랩,공용,메탈,20mm,,,,기종별 일반형 20mm
싱글 체인 레더 스트랩,공용,가죽,20mm,,,,기종별 일반형 20mm
레더 체인 스틸 스트랩,공용,가죽,20mm,,,,기종별 일반형 20mm
일반형 싱글 투어 가죽 스트랩,공용,가죽,20mm,,,,기종별 일반형 20mm
슬림 레더 가죽 스트랩,공용,가죽,20mm,,,,기종별 일반형 20mm
디버클 슬림 레더 가죽 스트랩,공용,가죽,20mm,마그네틱,,,기종별 일반형 20mm
모던 레더 가죽 스트랩,공용,가죽,20mm,,,,기종별 일반형 20mm
빈티지 레더 가죽 스트랩,공용,가죽,20mm,,,,기종별 일반형 20mm
가죽 링크 스트랩,공용,가죽,20mm,,,,기종별 일반형 20mm
코도반 가죽 레더 스트랩,공용,가죽,20mm,,,,기종별 일반형 20mm
컴포트 핏 버클 나일론 실리콘 스트랩,공용,실리콘,20mm,버클,,,기종별 일반형 20mm
모노핏 프리미엄 마그네틱 버클 나일론 스트랩,공용,패브릭,20mm,디버클(마그네틱),,images/03_53.jpg,기종별 일반형 20mm
에어핏 스포츠 버튼 투톤 실리콘 스트랩,공용,실리콘,20mm,버튼,,images/03_54.jpg,기종별 일반형 20mm
블랙 버클 펀칭 실리콘 스트랩,공용,실리콘,20mm,버클,,images/03_55.jpg,기종별 일반형 20mm
에어 위브 프리미엄 마그네틱 버클 나일론 스트랩,공용,나일론,20mm,마그네틱,,images/03_56.jpg,기종별 일반형 20mm
에어 슬로프 밸크로 패브릭 나일론 스트랩,공용,나일론,20mm,벨크로,,images/03_57.jpg,기종별 일반형 20mm
포우 레더 메탈 버클 마그넷 링크 스트랩,공용,가죽,20mm,마그네틱,,images/03_58.jpg,기종별 일반형 20mm
투톤 베이직 실리콘 스트랩,공용,실리콘,20mm,버클,,images/03_59.jpg,기종별 일반형 20mm
스무스 릿지 실리콘 스트랩,공용,실리콘,20mm,버클,,images/03_60.jpg,기종별 일반형 20mm
퓨어 글리터 젤리 투명 스트랩,공용,TPU,20mm,버클,,images/03_61.jpg,기종별 일반형 20mm
크로코 클래식 포우 레더 스트랩,공용,가죽,20mm,버클,,images/03_62.jpg,기종별 일반형 20mm
스퍼트 투톤 버클 실리콘 스트랩,공용,실리콘,20mm,버클,,images/03_63.jpg,기종별 일반형 20mm
트위스트 체인 메탈 스트랩,공용,메탈,20mm,체인,,images/03_64.jpg,기종별 일반형 20mm
러너 스피드 실리콘 스트랩,공용,실리콘,20mm,,,images/03_65.jpg,기종별 일반형 20mm
매트 그레인 마그넷 링크 실리콘 스트랩 20mm,공용,실리콘,20mm,마그네틱,,images/03_66.jpg,기종별 일반형 20mm
듀오 매트 그레인 마그넷 링크 실리콘 스트랩 20mm,공용,실리콘,20mm,마그네틱,,images/03_67.jpg,기종별 일반형 20mm
하트 캔디 팝 비즈 스트랩 20mm,공용,비즈,20mm,,,images/03_68.jpg,기종별 일반형 20mm
스트라이프 엣지 마그넷 링크 실리콘 스트랩 20mm,공용,실리콘,20mm,마그네틱,,images/03_69.jpg,기종별 일반형 20mm
데님 스티치 하이브리드 디버클 나일론 실리콘 스트랩 20mm,공용,실리콘,20mm,디버클(마그네틱),,images/03_70.jpg,기종별 일반형 20mm
듀오링 스포츠 나일론 스트랩 (*기종별),공용,패브릭,20mm,,,images/03_71.jpg,기종별 일반형 20mm
투명 크리스탈 스트랩 20mm,공용,PC,20mm,,,,기종별 일반형 20mm
투톤 펀칭 실리콘 스트랩 22mm,공용,실리콘,20mm,,,,기종별 일반형 20mm
베이직 실리콘 스트랩,공용,실리콘,22mm,,,,기종별 일반형 22mm
버튼 베이직 실리콘 스트랩,공용,실리콘,22mm,버튼,,images/04_3.jpg,기종별 일반형 22mm
버튼 스포티 스트랩,공용,실리콘,22mm,버튼,,images/04_4.jpg,기종별 일반형 22mm
디버클 마그네틱 스포티 실리콘 스트랩,공용,실리콘,22mm,디버클(마그네틱),,images/04_5.jpg,기종별 일반형 22mm
어반 실리콘 스트랩,공용,실리콘,22mm,,,images/04_6.jpg,기종별 일반형 22mm
디버클 마그네틱 실리콘 스트랩,공용,실리콘,22mm,디버클(마그네틱),,images/04_7.jpg,기종별 일반형 22mm
펀칭 실리콘 스트랩 (*실버 버클),공용,실리콘,22mm,버클,,images/04_8.jpg,기종별 일반형 22mm
와플 패턴 실리콘 스트랩,공용,실리콘,22mm,,,images/04_9.jpg,기종별 일반형 22mm
스트릿 엣지 실리콘 스트랩,공용,실리콘,22mm,,,images/04_10.jpg,기종별 일반형 22mm
소프트 마그넷 링크 실리콘 스트랩,공용,실리콘,22mm,마그네틱,,images/04_11.jpg,기종별 일반형 22mm
디버클 블랜드 투톤 실리콘 스트랩,공용,실리콘,22mm,디버클(마그네틱),,images/04_12.jpg,기종별 일반형 22mm
디버클 오션 실리콘 스트랩,공용,실리콘,22mm,디버클(마그네틱),,images/04_13.jpg,기종별 일반형 22mm
모노 스트랩 (스포츠루프),공용,패브릭,22mm,스포츠루프,,images/04_14.jpg,기종별 일반형 22mm
브레이드 스트랩,공용,패브릭,22mm,브레이드,,images/04_15.jpg,기종별 일반형 22mm
마그넷 브레이드,공용,패브릭,22mm,마그네틱,,images/04_16.jpg,기종별 일반형 22mm
버클 브레이드 스트랩,공용,패브릭,22mm,브레이드,,images/04_17.jpg,기종별 일반형 22mm
마그넷 루프 스트랩,공용,패브릭,22mm,마그네틱,,images/04_18.jpg,기종별 일반형 22mm
니트 스트랩,공용,패브릭,22mm,,,images/04_19.jpg,기종별 일반형 22mm
스트래치 나일론 스트랩,공용,패브릭,22mm,,,images/04_20.jpg,기종별 일반형 22mm
풀텝 스포츠루프,공용,패브릭,22mm,스포츠루프,,images/04_21.jpg,기종별 일반형 22mm
후크형 트레일 패브릭 나일론 스트랩,공용,패브릭,22mm,,,images/04_22.jpg,기종별 일반형 22mm
메탈 스트랩,공용,메탈,22mm,,,images/04_23.jpg,기종별 일반형 22mm
(버클) 슬림 메탈 스트랩,공용,메탈,22mm,버클,,images/04_24.jpg,기종별 일반형 22mm
일반형 디버클 마그네틱 메탈 스트랩,공용,메탈,22mm,디버클(마그네틱),,images/04_25.jpg,기종별 일반형 22mm
스틸 스트랩 (*구버전),공용,스틸,22mm,,,images/04_26.jpg,기종별 일반형 22mm
알파 프레스티지 스틸 스트랩 (*스틸 스트랩의 신 버전),공용,스틸,22mm,,,images/04_27.jpg,기종별 일반형 22mm
슬림 스틸 스트랩,공용,메탈,22mm,,,,기종별 일반형 22mm
쥬빌레 스틸 스트랩,공용,메탈,22mm,,,images/04_29.jpg,기종별 일반형 22mm
체인 스틸 스트랩,공용,메탈,22mm,,,images/04_30.jpg,기종별 일반형 22mm
싱글 체인 레더 스트랩,공용,가죽,22mm,,,images/04_31.jpg,기종별 일반형 22mm
레더 체인 스틸 스트랩,공용,가죽,22mm,,,images/04_32.jpg,기종별 일반형 22mm
샤인 큐빅 메탈 스트랩,공용,메탈,22mm,,,images/04_33.jpg,기종별 일반형 22mm
샤인 큐빅 트리플 스트랩,공용,메탈,22mm,,,images/04_34.jpg,기종별 일반형 22mm
샤인 큐빅 슬림 브레이슬릿 스트랩,공용,가죽,22mm,,,images/04_35.jpg,기종별 일반형 22mm
싱글 투어 레더 스트랩,공용,가죽,22mm,,,images/04_36.jpg,기종별 일반형 22mm
슬림 레더 스트랩,공용,가죽,22mm,,,images/04_37.jpg,기종별 일반형 22mm
빈티지 레더 스트랩,공용,가죽,22mm,,,images/04_38.jpg,기종별 일반형 22mm
마그네틱 디버클 슬림 레더 스트랩,공용,가죽,22mm,디버클(마그네틱),,images/04_39.jpg,기종별 일반형 22mm
코도반 가죽 레더 스트랩,공용,가죽,22mm,,,images/04_40.jpg,기종별 일반형 22mm
컴포트 핏 버클 나일론 실리콘 스트랩 22mm,공용,나일론,22mm,버클,,images/04_41.jpg,기종별 일반형 22mm
컴포트 핏 디버클 나일론 실리콘 스트랩 22mm,공용,나일론,22mm,디버클(마그네틱),,images/04_42.jpg,기종별 일반형 22mm
모노핏 프리미엄 마그네틱 버클 나일론 스트랩,공용,나일론,22mm,마그네틱,,images/04_43.jpg,기종별 일반형 22mm
브리즈 포우 레더 스트랩,공용,가죽,22mm,,,,기종별 일반형 22mm
에어 위브 프리미엄 마그네틱 버클 나일론 스트랩,공용,나일론,22mm,마그네틱,,images/04_45.jpg,기종별 일반형 22mm
에어 슬로프 밸크로 패브릭 나일론 스트랩,공용,패브릭,22mm,벨크로,,images/04_46.jpg,기종별 일반형 22mm
러너 스피드 실리콘 스트랩 (*570의 정품 디자인 호환),공용,실리콘,22mm,,,images/04_47.jpg,기종별 일반형 22mm
포우 레더 메탈 버클 마그넷 링크 스트랩 22mm,공용,가죽,22mm,마그네틱,,images/04_48.jpg,기종별 일반형 22mm
에어핏 스포츠 버튼 투톤 실리콘 스트랩,공용,실리콘,22mm,버튼,,images/04_49.jpg,기종별 일반형 22mm
크로코 클래식 포우 레더 스트랩,공용,가죽,22mm,,"블랙, 미드나잇블루, 래드, 핑크, 화이트,브라운, 초코브라운",,기종별 일반형 22mm
투톤 베이직 실리콘 스트랩,공용,실리콘,22mm,,,images/04_51.jpg,기종별 일반형 22mm
퓨어 글리터 젤리 투명 스트랩 22mm,공용,TPU,22mm,,,images/04_52.jpg,기종별 일반형 22mm
스퍼트 투톤 버클 실리콘 스트랩 22mm,공용,실리콘,22mm,버클,"블랙그레이, 미드나잇화이트, 화이트블랙 불랙옐로우, 레드블랙, 카키블랙 민트미드나잇, 라임블랙",images/04_53.jpg,기종별 일반형 22mm
플렉서블 링크 프레스티지 티타늄 스트랩 22mm,공용,티타늄,22mm,,"블랙,실버 티타늄,그레이티타늄",images/04_54.jpg,기종별 일반형 22mm
플렉서블 링크 프레스티지 스틸 스트랩 22mm,공용,스틸,22mm,,,images/04_55.jpg,기종별 일반형 22mm
후크 투톤 패브릭 나일론 스트랩 22mm (*구 알파인루프 디자인),공용,패브릭,22mm,루프,🔴 4컬러 미입고,images/04_56.jpg,기종별 일반형 22mm
듀얼 쉐이드 마그네틱 실리콘 스트랩 22mm,공용,실리콘,22mm,마그네틱,,images/04_57.jpg,기종별 일반형 22mm
오션 실리콘 스트랩 22mm,공용,실리콘,22mm,,,,기종별 일반형 22mm
런 스플릿 투톤 실리콘 스트랩 22mm,공용,실리콘,22mm,,,images/04_59.jpg,기종별 일반형 22mm
에어 그리드 애슬레틱 버튼 실리콘 스트랩 22mm,공용,실리콘,22mm,버튼,,images/04_60.jpg,기종별 일반형 22mm
버티컬 그리드 애슬레틱 실리콘 스트랩 22mm,공용,실리콘,22mm,,,images/04_61.jpg,기종별 일반형 22mm
플렉스 니트 하이브리드 버클 나일론 실리콘 스트랩 22mm,공용,하이브리드,22mm,버클,,images/04_62.jpg,기종별 일반형 22mm
데님 스티치 하이브리드 디버클 나일론 실리콘 스트랩 22mm,공용,하이브리드,22mm,디버클(마그네틱),,images/04_63.jpg,기종별 일반형 22mm
매트 그레인 마그넷 링크 실리콘 스트랩 22mm,공용,실리콘,22mm,마그네틱,,images/04_64.jpg,기종별 일반형 22mm
멜로우 플레인 버클 TPU 젤리 스트랩 22mm,공용,TPU,22mm,버클,,images/04_65.jpg,기종별 일반형 22mm
듀오 매트 그레인 마그넷 링크 실리콘 스트랩 22mm,공용,실리콘,22mm,마그네틱,,images/04_66.jpg,기종별 일반형 22mm
블로키 메탈 버클 실리콘 스트랩 22mm,공용,실리콘,22mm,버클,,images/04_67.jpg,기종별 일반형 22mm
매시브 메탈 버클 실리콘 스트랩 22mm,공용,실리콘,22mm,버클,,images/04_68.jpg,기종별 일반형 22mm
프레스티지 퍼포먼스 듀얼 컴파운드 실리콘 티타늄 스트랩 22mm,공용,티타늄,22mm,,,,기종별 일반형 22mm
하트 캔디 팝 비즈 스트랩 22mm,공용,비즈,22mm,,,images/04_70.jpg,기종별 일반형 22mm
퀄팅 스티치 디버클 포우 레더 스트랩 22mm,공용,가죽,22mm,디버클(마그네틱),,images/04_71.jpg,기종별 일반형 22mm
스트라이프 엣지 마그넷 링크 실리콘 스트랩 22mm,공용,실리콘,22mm,마그네틱,,images/04_72.jpg,기종별 일반형 22mm
투톤 블로키 버클 실리콘 스트랩 22mm,공용,실리콘,22mm,버클,,images/04_73.jpg,기종별 일반형 22mm
오션 마그네틱 버클 프레스티지 스틸 스트랩 22mm,공용,스틸,22mm,마그네틱,,images/04_74.jpg,기종별 일반형 22mm
와이트릭 마그넷 링크 메탈 스트랩 22mm,공용,스틸,22mm,마그네틱,,images/04_75.jpg,기종별 일반형 22mm
세그먼트 마그넷 링크 실리콘 스트랩 22mm,공용,실리콘,22mm,마그네틱,,images/04_76.jpg,기종별 일반형 22mm
투명 크리스탈 스트랩 22mm,공용,PC,22mm,,,images/04_77.jpg,기종별 일반형 22mm
러닝 마스터 스포츠 실리콘 스트랩 22mm,공용,실리콘,22mm,,,images/04_78.jpg,기종별 일반형 22mm
런 업 스트래치 밸크로 패브릭 나일론 스트랩 22mm,공용,패브릭,22mm,,,images/04_79.jpg,기종별 일반형 22mm
듀오링 스포츠 나일론 스트랩 22mm,공용,패브릭,22mm,,,images/04_80.jpg,기종별 일반형 22mm
알파 프레스티지 스틸 스트랩 22mm,공용,스틸,22mm,,,images/04_81.jpg,기종별 일반형 22mm
투톤 펀칭 실리콘 스트랩 22mm,공용,실리콘,22mm,,,images/04_82.jpg,기종별 일반형 22mm
듀오 스트라이프 스티치 디버클 포우 레더 스트랩 22mm 🔴 단종 확정 스트랩,공용,가죽,22mm,디버클(마그네틱),,images/04_83.jpg,기종별 일반형 22mm
후크 투톤 패브릭 나일론 스트랩 24mm,공용,패브릭,24mm,벨크로,,,기종별 일반형 24mm
마일드 트레일 패브릭 나일론 스트랩 24mm,공용,패브릭,24mm,버클,,,기종별 일반형 24mm
와일드 스포츠 패브릭 나일론 스트랩 24mm,공용,패브릭,24mm,버클,,images/05_4.jpg,기종별 일반형 24mm
프레스티지 퍼포먼스 듀얼 컴파운드 실리콘 티타늄 스트랩 논점 🔔네이밍 기준 어긋남,프레스티지 라인업,티타늄,,,,,프레스티지 라인업
알파 프레스티지 스틸 스트랩 *구_ 스틸 스트랩,프레스티지 라인업,스틸,,,,images/06_3.jpg,프레스티지 라인업
베이직 링크 프레스티지 스틸 스트랩 *버터플라이 체결방식,프레스티지 라인업,스틸,,,,,프레스티지 라인업
베이직 링크 프레스티지 티타늄 스트랩 *버터플라이 체결방식,프레스티지 라인업,티타늄,,,,images/06_5.jpg,프레스티지 라인업
마그네틱 버클 링크 프레스티지 스틸 스트랩 *마그네틱 버클 체결 방식,프레스티지 라인업,스틸,,마그네틱,,,프레스티지 라인업
마그네틱 링크 프레스티지 티타늄 스트랩 *마그네틱 버클 체결 방식,프레스티지 라인업,티타늄,,마그네틱,,images/06_7.jpg,프레스티지 라인업
마그네틱 버클 링크 프레스티지 스틸 스트랩 * 마그네틱 +모듈 체결 방식,프레스티지 라인업,스틸,,마그네틱,,,프레스티지 라인업
마그네틱 버클 링크 프레스티지 티타늄 스트랩 * 마그네틱 +모듈 체결 방식,프레스티지 라인업,티타늄,,마그네틱,,images/06_9.jpg,프레스티지 라인업
플렉서블 링크 프레스티지 티타늄 스트랩,프레스티지 라인업,티타늄,,,,images/06_10.jpg,프레스티지 라인업
플렉서블 링크 프레스티지 스틸 스트랩,프레스티지 라인업,스틸,,,,images/06_11.jpg,프레스티지 라인업
오션 마그네틱 버클 프레스티지 스틸 스트랩,프레스티지 라인업,스틸,,마그네틱,,,프레스티지 라인업
리갈 프레스티지 스틸 스트랩 *버터플라이 체결 방식,프레스티지 라인업,스틸,,,,images/06_13.jpg,프레스티지 라인업
리갈 프레스티지 티타늄 스트랩 *버터플라이 체결 방식,프레스티지 라인업,티타늄,,,,images/06_14.jpg,프레스티지 라인업
투 라인 프레스티지 버터플라이 버클 일체형 스틸 스트랩,프레스티지 라인업,스틸,,일체형,,images/06_15.jpg,프레스티지 라인업
오션 마그네틱 버클 프레스티지 스테인레스 스트랩,프레스티지 라인업,,,마그네틱,,images/06_16.jpg,프레스티지 라인업
브레이드 솔로루프 스트랩,애플워치,패브릭,,일체형,,images/07_2.jpg,애플워치
트레일 스포츠 루프,애플워치,패브릭,,스포츠루프,,images/07_3.jpg,애플워치
밀레니즈 루프 스트랩,애플워치,메탈,,루프,,images/07_4.jpg,애플워치
슬림 밀레니즈 루프 스트랩,애플워치,메탈,,루프,,images/07_5.jpg,애플워치
모던 핏 스틸 스트랩,애플워치,스틸,,,,images/07_6.jpg,애플워치
프리미엄 슬림 모던 핏 스틸 스트랩,애플워치,스틸,,,,images/07_7.jpg,애플워치
쥬빌레 스트랩,애플워치,스틸,,,,images/07_8.jpg,애플워치
슬림 쥬빌레,애플워치,스틸,,,,images/07_9.jpg,애플워치
클리어 스트랩,애플워치,PC,,,,images/07_10.jpg,애플워치
클리어 체인 스트랩,애플워치,PC,,,,images/07_11.jpg,애플워치
일체형 클리어 스트랩,애플워치,TPU,,일체형,,images/07_12.jpg,애플워치
크리스탈 큐빅 브레이슬릿 스트랩,애플워치,스틸,,,,images/07_13.jpg,애플워치
크리스탈 큐빅 스트랩,애플워치,스틸,,,,images/07_14.jpg,애플워치
체인 모던핏 스트랩,애플워치,스틸,,,,images/07_15.jpg,애플워치
오션 실리콘 스트랩,애플워치,실리콘,,,,images/07_16.jpg,애플워치
버튼 실리콘 스트랩,애플워치,실리콘,,버튼,,images/07_17.jpg,애플워치
https://detail.1688.com/offer/1015528539845.html?share_token=MgjPiHEQhJDIWF2CiWu1GEO3vWAWlEjmqYmLtluErdDxKNftO8HgNQ%3D%3D&__share_id=17f09bd1-747c-47a5-a388-4f9559847ad0&rpg-cnt=share.offerDetail&offerId=1015528539845&__zhi_token=yh8yhO500zrak&spm=a262eq.8992535%2F20260305.5103953.0&forcePC=1772666352023,애플워치,,,,,images/07_18.jpg,애플워치
에어 슬로프 밸크로 패브릭 나일론 스트랩,화웨이 워치 핏4,패브릭,,벨크로,"블랙,실버,미드나잇블루 블루,핑크,오렌지 샌드핑크,스카이,라벤더 버건디,카키,올리브 스타라이트 하이퍼핑크,세이지민트 ⬇️ 네이버 단독 (4) 초코브라운, 레몬옐로우, 더스티네이비,더스티민트",images/08_2.jpg,화웨이 워치 핏4
매트 그레인 마그넷 링크 실리콘 스트랩,화웨이 워치 핏4,실리콘,,마그네틱,"블랙, 미드나잇블루, 다크그레이, 스타라이트, 스타오렌지, 스타스카이, 샌드스타라이트, 레몬옐로우, 라임, 버건디블랙, 라벤더, 화이트",images/08_3.jpg,화웨이 워치 핏4
메탈 스트랩,화웨이 워치 핏4,메탈,,,"블랙,실버,골드 로즈골드,로즈핑크,스타라이트",,화웨이 워치 핏4
베이직 버클 실리콘 스트랩,화웨이 워치 핏4,실리콘,,버클,"블랙, 미드나잇블루, 실버 레드, 머스타드, 오렌지, 다크그린,올리브, 샌드핑크, 라벤더, 스타라이트, 화이트",images/08_5.jpg,화웨이 워치 핏4
모션 트레드 버클 실리콘 스트랩,화웨이 워치 핏4,실리콘,,버클,"블랙,미드나잇블루,실버 레드,머스타드,오렌지 스카이,카키,버건디, 샌드핑크,라벤더,민트 다크그레이,화이트,스타라이트",,화웨이 워치 핏4
디버클 마그네틱 메쉬홀 실리콘 스트랩,화웨이 워치 핏4,실리콘,,디버클(마그네틱),"블랙, 미드나잇블루, 실버, 오렌지, 카키, 올리브, 샌드핑크, 버건디, 스타라이트, 화이트",,화웨이 워치 핏4
프리미엄 마그네틱 버클 브레이드 스트랩,화웨이 워치 핏4,패브릭,,마그네틱,"블랙, 미드나잇블루, 인디고, 스타라이트블랙, 스타라이트, 스타포인트, 샌드핑크, 체리블러썸, 솜사탕, 레인보우,레인보우블랙,레인보우B",images/08_8.jpg,화웨이 워치 핏4
갤럭시 워치8 호환 샤인 큐빅 메탈 스트랩,갤럭시 워치8 러그형,메탈,22mm 스트랩 + 러그형 커넥터,,"블랙,실버,로즈골드",,갤럭시 워치8 러그형
갤럭시 워치8 클래식 샤인 큐빅 메탈 스트랩,갤럭시 워치8 러그형,,,,,,갤럭시 워치8 러그형
갤럭시 워치8 호환 샤인 큐빅 슬림 브레이슬릿 스트랩,갤럭시 워치8 러그형,메탈,22mm 스트랩 + 러그형 커넥터,,"실버,로즈골드",,갤럭시 워치8 러그형
갤럭시 워치8 클래식 샤인 큐빅 슬림 브레이슬릿 스트랩,갤럭시 워치8 러그형,,,,,images/09_66.jpg,갤럭시 워치8 러그형
갤럭시 워치8 호환 체인 스틸 스트랩,갤럭시 워치8 러그형,메탈,22mm 스트랩 + 러그형 커넥터,,"블랙,실버,로즈골드",,갤럭시 워치8 러그형
갤럭시 워치8 클래식 체인 스틸 스트랩,갤럭시 워치8 러그형,,,,,,갤럭시 워치8 러그형
갤럭시 워치8 호환 레더 체인 스틸 스트랩,갤럭시 워치8 러그형,메탈,22mm 스트랩 + 러그형 커넥터,,블랙+블랙 실버+블랙 실버+화이트 로즈골드+블랙 로즈골드+화이트,images/09_69.jpg,갤럭시 워치8 러그형
갤럭시 워치8 클래식 레더 체인 스틸 스트랩,갤럭시 워치8 러그형,,,,,,갤럭시 워치8 러그형
갤럭시 워치8 호환 샤인 큐빅 트리플 스트랩,갤럭시 워치8 러그형,메탈,22mm 스트랩 + 러그형 커넥터,,"실버,로즈골드",,갤럭시 워치8 러그형
갤럭시 워치8 클래식 샤인 큐빅 트리플 스트랩,갤럭시 워치8 러그형,,,,,images/09_72.jpg,갤럭시 워치8 러그형
