제품명,기종,재질,스트랩 규격,체결 형태,색상,이미지,원본탭
갤럭시 워치8 호환 싱글 체인 레더 스트랩,갤럭시 워치8 러그형,메탈,22mm 스트랩 + 러그형 커넥터,,블랙 화이트 브라운 인디베이지,,갤럭시 워치8 러그형
갤럭시 워치8 클래식 싱글 체인 레더 스트랩,갤럭시 워치8 러그형,,,,,,갤럭시 워치8 러그형
갤럭시 워치8 호환 싱글 투어 레더 스트랩,갤럭시 워치8 러그형,가죽,22mm 스트랩 + 실버 러그형 커넥터,버클,매트화이트 오렌지 앰버 인디베이지 블랙콤비 인디고콤비 블루그레이콤비 핑크콤비,images/09_75.jpg,갤럭시 워치8 러그형
갤럭시 워치8 클래식 싱글 투어 레더 스트랩,갤럭시 워치8 러그형,,,,,,갤럭시 워치8 러그형
갤럭시 워치8 호환 슬림 레더 스트랩,갤럭시 워치8 러그형,가죽,22mm 스트랩 + 실버 러그형 커넥터,버클,블랙 화이트 브라운 라이트브라운 파스텔핑크 체리블러썸 라벤더 그레이 옐로우 민트,,갤럭시 워치8 러그형
갤럭시 워치8 클래식 호환 슬림 레더 스트랩,갤럭시 워치8 러그형,,,,,images/09_78.jpg,갤럭시 워치8 러그형
갤럭시 워치8 호환 마그네틱 디버클 슬림 레더 스트랩,갤럭시 워치8 러그형,가죽,22mm 스트랩 + 실버 러그형 커넥터,디버클(마그네틱),블랙 인디실버 스타라이트 라벤더 브라운 스타라이트&핑크 스타라이트&라벤더 스타라이트&브라운,,갤럭시 워치8 러그형
갤럭시 워치8 클래식 마그네틱 디버클 슬림 레더 스트랩,갤럭시 워치8 러그형,,,디버클(마그네틱),,,갤럭시 워치8 러그형
갤럭시 워치8 호환 빈티지 레더 스트랩,갤럭시 워치8 러그형,가죽,22mm 스트랩 + 실버 or 블랙 러그형 커넥터,버클,그레이 블랙 ➡ 얘만 블랙 커넥터 조합 그린 옐로우 브라운 오렌지브라운 네이비,images/09_81.jpg,갤럭시 워치8 러그형
갤럭시 워치8 클래식 빈티지 레더 스트랩,갤럭시 워치8 러그형,,,,,,갤럭시 워치8 러그형
갤럭시 워치8 호환 브리즈 포우 레더 스트랩,갤럭시 워치8 러그형,가죽,22mm 스트랩 + 실버 러그형 커넥터,버클,블랙레인보우 인디베이지 네이비 블랙다크그린 그레이블루 옐로우,,갤럭시 워치8 러그형
갤럭시 워치8 클래식 호환 브리즈 포우 레더 스트랩,갤럭시 워치8 러그형,,,,,images/09_84.jpg,갤럭시 워치8 러그형
갤럭시 워치8 호환 크로코 클래식 포우 레더 스트랩,갤럭시 워치8 러그형,가죽,22mm 스트랩 + 실버 러그형 커넥터,버클,블랙 미드나잇블루 레드 핑크 화이트 브라운 초코브라운,,갤럭시 워치8 러그형
갤럭시 워치8 클래식 호환 크로코 클래식 포우 레더 스트랩,갤럭시 워치8 러그형,,,,,,갤럭시 워치8 러그형
갤럭시 워치8 호환 컴포트 핏 버클 나일론 실리콘 스트랩,갤럭시 워치8 러그형,가죽,22mm 스트랩 + 실버 러그형 커넥터,버클,"블랙, 미드나잇블루,그레이, 카키, 블루그레이,스타라이트",images/09_87.jpg,갤럭시 워치8 러그형
갤럭시 워치8 클래식 호환 컴포트 핏 버클 나일론 실리콘 스트랩,갤럭시 워치8 러그형,,,버클,,,갤럭시 워치8 러그형
갤럭시 워치8 호환 컴포트 핏 디버클 나일론 실리콘 스트랩,갤럭시 워치8 러그형,가죽,22mm 스트랩 + 실버 러그형 커넥터,버클,"블랙, 그레이, 오렌지, 블루그레이, 카키",,갤럭시 워치8 러그형
갤럭시 워치8 클래식 호환 컴포트 핏 디버클 나일론 실리콘 스트랩,갤럭시 워치8 러그형,,,디버클(마그네틱),,images/09_90.jpg,갤럭시 워치8 러그형
갤럭시 워치8 호환 플렉스 니트 하이브리드 버클 나일론 실리콘 스트랩,갤럭시 워치8 러그형,가죽,22mm 스트랩 + 실버 러그형 커넥터,버클,"블랙,그레이블루,버건디 그레이스카이,틸블루,다크그린 스타라이트,인디베이지",,갤럭시 워치8 러그형
갤럭시 워치8 클래식 호환 플렉스 니트 하이브리드 버클 나일론 실리콘 스트랩,갤럭시 워치8 러그형,,,버클,,,갤럭시 워치8 러그형
갤럭시 워치8 호환 매트 그레인 마그넷 링크 실리콘 스트랩,갤럭시 워치8 러그형,실리콘,22mm 스트랩 + 실버 러그형 커넥터,마그네틱,"블랙, 블랙오렌지, 오렌지블랙, 미드나잇블루, 다크그레이, 카키블랙, 스타라이트, 스타오렌지, 스타스카이, 샌드스타라이트, 화이트, 라임",images/09_93.jpg,갤럭시 워치8 러그형
갤럭시 워치8 클래식 호환 매트 그레인 마그넷 링크 실리콘 스트랩,갤럭시 워치8 러그형,,,마그네틱,,,갤럭시 워치8 러그형
갤럭시 워치8 호환 스트라이프 엣지 마그넷 링크 실리콘 스트랩,갤럭시 워치8 러그형,실리콘,22mm 스트랩 + 실버 러그형 커넥터,마그네틱,,,갤럭시 워치8 러그형
갤럭시 워치8 클래식 호환 스트라이프 엣지 마그넷 링크 실리콘 스트랩,갤럭시 워치8 러그형,,,마그네틱,,images/09_96.jpg,갤럭시 워치8 러그형
갤럭시 워치8 호환 매시브 메탈 버클 실리콘 스트랩,갤럭시 워치8 러그형,실리콘,22mm 스트랩 + 실버 러그형 커넥터,버클,"블랙그레이,미드나잇화이트,블랙레드, 블랙오렌지,다크그레이오렌지,스타오렌지, 초코브라운,카키블랙,화이트블루",,갤럭시 워치8 러그형
갤럭시 워치8 클래식 호환 매시브 메탈 버클 실리콘 스트랩,갤럭시 워치8 러그형,,,버클,,,갤럭시 워치8 러그형
갤럭시 워치8 호환 듀오링 스포츠 나일론 스트랩,갤럭시 워치8 러그형,패브릭,22mm 스트랩 + 실버 러그형 커넥터,벨크로,"블랙, 미드나잇블루, 실버화이트, 옐로우, 펄핑크, 파파야, 알레스칸블루, 라임, 펄라임, 팬텀실버, 민트그린, 메이징크, 네온라임, 스모키로즈, 카모그린",images/09_99.jpg,갤럭시 워치8 러그형
갤럭시 워치8 클래식 호환 듀오링 스포츠 나일론 스트랩,갤럭시 워치8 러그형,,,,,,갤럭시 워치8 러그형
갤럭시 워치8 호환 에어 그리드 애슬레틱 버튼 실리콘 스트랩,갤럭시 워치8 러그형,실리콘,22mm 스트랩 + 실버 러그형 커넥터,버클,,,갤럭시 워치8 러그형
갤럭시 워치8 클래식 호환 에어 그리드 애슬레틱 버튼 실리콘 스트랩,갤럭시 워치8 러그형,,,버튼,,images/09_102.jpg,갤럭시 워치8 러그형
갤럭시 워치8 호환,갤럭시 워치8 러그형,,,,,,갤럭시 워치8 러그형
갤럭시 워치8 클래식 호환,갤럭시 워치8 러그형,,,,,,갤럭시 워치8 러그형
갤럭시 워치8 호환,갤럭시 워치8 러그형,,,,,images/09_105.jpg,갤럭시 워치8 러그형
갤럭시 워치8 클래식 호환,갤럭시 워치8 러그형,,,,,,갤럭시 워치8 러그형
갤럭시 워치8 호환 버클 파스텔 스트랩,갤럭시 워치8 러그형,패브릭,20mm 스트랩 + 실버 러그형 커넥터,버클,,images/09_108.jpg,갤럭시 워치8 러그형
갤럭시 워치8 클래식 호환 버클 파스텔 스트랩,갤럭시 워치8 러그형,,,버클,,,갤럭시 워치8 러그형
갤럭시 워치 울트라 호환 🟩🟩🟩 스트랩,갤럭시 울트라 47mm,,,,,,갤럭시 울트라 47mm
갤럭시 워치 울트라 2025 호환 🟩🟩🟩🟩 스트랩,갤럭시 울트라 47mm,,,,,,갤럭시 울트라 47mm
갤럭시 워치 울트라 호환 듀오링 스포츠 나일론 스트랩,갤럭시 울트라 47mm,,,,,images/10_6.jpg,갤럭시 울트라 47mm
갤럭시 워치 울트라 2025 호환 듀오링 스포츠 나일론 스트랩,갤럭시 울트라 47mm,,,,,,갤럭시 울트라 47mm
갤럭시 워치 울트라 호환 모딕 메쉬 메탈 스트랩,갤럭시 울트라 47mm,,,,,images/10_9.jpg,갤럭시 울트라 47mm
갤럭시 워치 울트라 2025 호환 모딕 메쉬 메탈 스트랩,갤럭시 울트라 47mm,,,,,,갤럭시 울트라 47mm
갤럭시 워치 울트라 호환 매시브 메탈 버클 실리콘 스트랩,갤럭시 울트라 47mm,,,버클,,images/10_12.jpg,갤럭시 울트라 47mm
갤럭시 워치 울트라 2025 호환 매시브 메탈 버클 실리콘 스트랩,갤럭시 울트라 47mm,,,버클,,,갤럭시 울트라 47mm
갤럭시 워치 울트라 호환 스트라이프 엣지 마그넷 링크 실리콘 스트랩,갤럭시 울트라 47mm,,,마그네틱,,images/10_15.jpg,갤럭시 울트라 47mm
갤럭시 워치 울트라 2025 호환 스트라이프 엣지 마그넷 링크 실리콘 스트랩,갤럭시 울트라 47mm,,,마그네틱,,,갤럭시 울트라 47mm
갤럭시 워치 울트라 호환 와이트릭 마그넷 링크 메탈 스트랩,갤럭시 울트라 47mm,,,마그네틱,,images/10_18.jpg,갤럭시 울트라 47mm
갤럭시 워치 울트라 2025 호환 와이트릭 마그넷 링크 메탈 스트랩,갤럭시 울트라 47mm,,,마그네틱,,,갤럭시 울트라 47mm
갤럭시 워치 울트라 호환 퍼포먼스 듀얼 컴파운드 프레스티지 실리콘 티타늄 스트랩,갤럭시 울트라 47mm,,,,,images/10_21.jpg,갤럭시 울트라 47mm
갤럭시 워치 울트라 2025 호환 퍼포먼스 듀얼 컴파운드 프레스티지 실리콘 티타늄 스트랩,갤럭시 울트라 47mm,,,,,,갤럭시 울트라 47mm
갤럭시 워치 울트라 호환 오션 마그네틱 버클 프레스티지 스테인리스 스트랩,갤럭시 울트라 47mm,,,마그네틱,,images/10_24.jpg,갤럭시 울트라 47mm
갤럭시 워치 울트라 2025 호환 오션 마그네틱 버클 프레스티지 스테인리스 스트랩,갤럭시 울트라 47mm,,,마그네틱,,,갤럭시 울트라 47mm
갤럭시 워치 울트라 호환 엑시엄 메탈 버클 실리콘 스트랩,갤럭시 울트라 47mm,,,버클,,images/10_27.jpg,갤럭시 울트라 47mm
갤럭시 워치 울트라 2025 호환 엑시엄 메탈 버클 실리콘 스트랩,갤럭시 울트라 47mm,,,버클,,,갤럭시 울트라 47mm
갤럭시 워치 울트라 호환 클리프 블랙 메탈 버클 실리콘 스트랩,갤럭시 울트라 47mm,,,,,,갤럭시 울트라 47mm
갤럭시 워치 울트라 2025 호환 클리프 블랙 메탈 버클 실리콘 스트랩,갤럭시 울트라 47mm,,,,,,갤럭시 울트라 47mm
갤럭시 워치 울트라 호환 프레임엑스 일체형 메탈 실리콘 스트랩,갤럭시 울트라 47mm,실리콘,,일체형,,,갤럭시 울트라 47mm
갤럭시 워치 울트라 2025 호환 프레임엑스 일체형 메탈 실리콘 스트랩,갤럭시 울트라 47mm,,,일체형,,,갤럭시 울트라 47mm
갤럭시워치 울트라 호환 디버클 마그네틱 스포티 실리콘 스트랩,갤럭시 울트라 47mm,실리콘,47mm,디버클(마그네틱),,,갤럭시 울트라 47mm
갤럭시 위치 울트라 2025 호환 디버클 마그네틱 스포티 실리콘 스트랩,갤럭시 울트라 47mm,실리콘,47mm,디버클(마그네틱),,,갤럭시 울트라 47mm
아머 플렉스 Privacy 사생활 보호 PC 강화유리 올인원 케이스,갤럭시 울트라 47mm,강화유리,47mm,,,,갤럭시 울트라 47mm
PC 강화유리 올인원 케이스,갤럭시 울트라 47mm,강화유리,47mm,,,,갤럭시 울트라 47mm
TPU 사이드 범퍼 케이스,갤럭시 울트라 47mm,TPU,47mm,,,,갤럭시 울트라 47mm
탠저린 베젤 강화유리 일체형 올인원 케이스,갤럭시 울트라 47mm,강화유리,47mm,일체형,,,갤럭시 울트라 47mm
갤럭시 워치 울트라 47mm 호환 강화유리 필름 3매,갤럭시 울트라 47mm,강화유리,47mm,,,,갤럭시 울트라 47mm
갤럭시 워치 울트라 2025 47mm 호환 강화유리 필름 3매,갤럭시 울트라 47mm,,,,,,갤럭시 울트라 47mm
갤럭시 워치 울트라 47mm 호환 TPU 필름 3매,갤럭시 울트라 47mm,TPU,47mm,,,,갤럭시 울트라 47mm
갤럭시 워치 울트라 2025 47mm 호환 TPU 필름 3매,갤럭시 울트라 47mm,,,,,,갤럭시 울트라 47mm
갤럭시 워치 울트라 47mm 호환 Privacy 사생활 필름 3매,갤럭시 울트라 47mm,사생활 강화유리,47mm,,,,갤럭시 울트라 47mm
갤럭시 워치 울트라 2025 47mm 호환 Privacy 사생활 필름 3매,갤럭시 울트라 47mm,,,,,,갤럭시 울트라 47mm
갤럭시 워치 울트라 47mm 호환 PMMA 필름 3매,갤럭시 울트라 47mm,PMMA,47mm,,,,갤럭시 울트라 47mm
Privacy 사생활 필름 3매 PMMA 필름 3매,갤럭시 울트라 47mm,,,,,,갤럭시 울트라 47mm
갤럭시 위치 울트라 호환 모던 패브릭 나일론 스트랩,갤럭시 울트라 47mm,패브릭,47mm,,,,갤럭시 울트라 47mm
베이직 실리콘 스트랩 1P (스스 모음전 대표),갤럭시 핏3,실리콘,,,,,갤럭시 핏3
베이직 실리콘 스트랩 2P,갤럭시 핏3,실리콘,,,,,갤럭시 핏3
스포티 실리콘 스트랩,갤럭시 핏3,실리콘,,,,,갤럭시 핏3
스포티 실리콘 스트랩 + TPU 범퍼 케이스,갤럭시 핏3,실리콘,,,,,갤럭시 핏3
디버클 마그네틱 실리콘 스트랩,갤럭시 핏3,실리콘,,디버클(마그네틱),,,갤럭시 핏3
펀치홀 실리콘 스트랩,갤럭시 핏3,실리콘,,,,,갤럭시 핏3
소프트 마그넷 링크 실리콘 스트랩,갤럭시 핏3,실리콘,,마그네틱,,images/11_7.jpg,갤럭시 핏3
듀오 매트 그레인 마그넷 링크 실리콘 스트랩,갤럭시 핏3,실리콘,,마그네틱,,,갤럭시 핏3
매트 그레인 마그넷 링크 실리콘 스트랩,갤럭시 핏3,실리콘,,마그네틱,,,갤럭시 핏3
오션 실리콘 스트랩,갤럭시 핏3,실리콘,,,,,갤럭시 핏3
하이브리드 레더 실리콘 스트랩,갤럭시 핏3,실리콘,,,,,갤럭시 핏3
디버클 마그네틱 메쉬홀 실리콘 스트랩,갤럭시 핏3,실리콘,,디버클(마그네틱),,,갤럭시 핏3
일체형 컬러 실리콘 스트랩,갤럭시 핏3,실리콘,,일체형,,,갤럭시 핏3
솔라 플립 일체형 스트랩,갤럭시 핏3,TPU,,일체형,,,갤럭시 핏3
러기드 아머 일체형 스트랩,갤럭시 핏3,TPU,,일체형,,,갤럭시 핏3
나토 스트랩,갤럭시 핏3,패브릭,,나토,,,갤럭시 핏3
스포츠 루프 스트랩,갤럭시 핏3,패브릭,,스포츠루프,,,갤럭시 핏3
스트레치 스트랩,갤럭시 핏3,패브릭,,,,,갤럭시 핏3
트레일 나일론 스트랩,갤럭시 핏3,패브릭,,,,,갤럭시 핏3
프리미엄 마그네틱 버클형 브레이드 스트랩,갤럭시 핏3,패브릭,,마그네틱,,,갤럭시 핏3
마그네틱 버클 파스텔 브레이드 스트랩,갤럭시 핏3,패브릭,,마그네틱,,,갤럭시 핏3
에어 슬로프 밸크로 패브릭 나일론 스트랩,갤럭시 핏3,,,벨크로,,images/11_22.jpg,갤럭시 핏3
프리미엄 메탈 스트랩,갤럭시 핏3,메탈,,,,,갤럭시 핏3
프리미엄 스틸 스트랩,갤럭시 핏3,메탈,,,,,갤럭시 핏3
링크 브레이슬릿 스틸 스트랩,갤럭시 핏3,메탈,,,,,갤럭시 핏3
쥬빌레 메탈 스트랩,갤럭시 핏3,메탈,,,,,갤럭시 핏3
슬림 쥬빌레 메탈 스트랩,갤럭시 핏3,메탈,,,,,갤럭시 핏3
체인 스틸 메탈 스트랩,갤럭시 핏3,메탈,,,,,갤럭시 핏3
헤링본 큐빅 메탈 스트랩,갤럭시 핏3,메탈,,,,,갤럭시 핏3
샤인 큐빅 메탈 스트랩,갤럭시 핏3,메탈,,,,,갤럭시 핏3
샤인 큐빅 슬림 브레이슬릿,갤럭시 핏3,메탈,단일,,"실버,로즈골드",images/11_31.jpg,갤럭시 핏3
큐빅 브레이슬릿 스트랩,갤럭시 핏3,메탈,,,,,갤럭시 핏3
벨라 링크 레더 스트랩,갤럭시 핏3,가죽,,,,,갤럭시 핏3
모던 레더 스트랩,갤럭시 핏3,가죽,,,,,갤럭시 핏3
트위드 레더 스트랩,갤럭시 핏3,가죽,,,,,갤럭시 핏3
T 버클형 모노 컬러 레더 스트랩,갤럭시 핏3,가죽,,버클,,,갤럭시 핏3
디버클 마그네틱 그레인 레더 스트랩,갤럭시 핏3,가죽,,디버클(마그네틱),,,갤럭시 핏3
핏3 호환 샤인큐빅 범퍼 케이스,갤럭시 핏3,PC,,,,,갤럭시 핏3
범퍼 TPU 케이스,갤럭시 핏3,TPU,,,,,갤럭시 핏3
풀커버 TPU 케이스,갤럭시 핏3,TPU,,,,,갤럭시 핏3
올인원 PC 케이스,갤럭시 핏3,PC,,,,,갤럭시 핏3
TPU 필름 3매,갤럭시 핏3,우레탄,,,,,갤럭시 핏3
핏3 PMMA 필름 3매,갤럭시 핏3,PMMA,,,,,갤럭시 핏3
핏3 충전케이블 1m USB-A타입,갤럭시 핏3,,,,,,갤럭시 핏3
핏3 충전케이블 1m USB-C타입,갤럭시 핏3,,,,,,갤럭시 핏3
갤럭시 핏3 호환 유니버셜 USB-A타입 충전 케이블,갤럭시 핏3,,,,,,갤럭시 핏3
이지포트 포터블 충전기 + C타입 변환 젠더 + 미니 파우치,갤럭시 핏3,,,,,,갤럭시 핏3
"갤럭시 핏3 호환 테크 아트 거치 스탠드 충전 크래들 1m, USB-A타입",갤럭시 핏3,,,,,,갤럭시 핏3
날개형 웨이브 스티치 실리콘 스트랩 (*스트릿엣지 디자인),갤럭시 날개형 20mm,실리콘,20mm,,"블랙,미드나잇블루,화이트,실버,샌드핑크,스타라이트,오렌지,머스타드,스카이,카키,딥그레이,라벤더",,갤럭시 날개형 20mm
날개형 '에어' 디버클 마그네틱 메쉬홀 실리콘 스트랩 (* 스트릿 엣지 스타일),갤럭시 날개형 20mm,실리콘,20mm,디버클(마그네틱),,,갤럭시 날개형 20mm
날개형 소프트 마그넷 링크 실리콘 스트랩,갤럭시 날개형 20mm,실리콘,20mm,마그네틱,,,갤럭시 날개형 20mm
날개형 마그넷 링크 실리콘 스트랩,갤럭시 날개형 20mm,실리콘,20mm,마그네틱,,,갤럭시 날개형 20mm
날개형 익스트림 실리콘 스트랩,갤럭시 날개형 20mm,실리콘,20mm,,,,갤럭시 날개형 20mm
날개형 스페이스핏 스틸 스트랩,갤럭시 날개형 20mm,메탈,20mm,,,,갤럭시 날개형 20mm
날개형 메탈 스트랩,갤럭시 날개형 20mm,메탈,20mm,,,,갤럭시 날개형 20mm
날개형 프리미엄 메탈 스트랩,갤럭시 날개형 20mm,메탈,20mm,,,,갤럭시 날개형 20mm
날개형 프리미엄 버클 스틸 스트랩 20mm,갤럭시 날개형 20mm,메탈,,버클,,,갤럭시 날개형 20mm
날개형 베이직 링크 브레이슬릿 스트랩,갤럭시 날개형 20mm,메탈,20mm,,,,갤럭시 날개형 20mm
날개형 프리미엄 링크 브레이슬릿 스트랩,갤럭시 날개형 20mm,메탈,20mm,,,,갤럭시 날개형 20mm
날개형 하이브리드 레더 실리콘 스트랩,갤럭시 날개형 20mm,가죽,20mm,,,images/14_12.jpg,갤럭시 날개형 20mm
날개형 베이직 가죽 레더 스트랩,갤럭시 날개형 20mm,가죽,20mm,,,,갤럭시 날개형 20mm
날개형 콘트라스트 마그네틱 실리콘 스트랩 20mm,갤럭시 날개형 20mm,실리콘,20mm,마그네틱,,,갤럭시 날개형 20mm
날개형 듀얼 쉐이드 마그네틱 실리콘 스트랩 20mm,갤럭시 날개형 20mm,실리콘,20mm,마그네틱,,,갤럭시 날개형 20mm
투톤 마린 오션 실리콘 스트랩,갤럭시 날개형 20mm,버클,20mm,,,,갤럭시 날개형 20mm
원클릭 날개형 베이직 스틸 스트랩,갤럭시 원클릭 20mm,메탈,20mm,원클릭,"블랙,실버,로즈골드,로즈핑크",,갤럭시 원클릭 20mm
원클릭 날개형 프리미엄 스틸 스트랩,갤럭시 원클릭 20mm,메탈,20mm,원클릭,"블랙,실버,로즈골드,로즈핑크,티타늄",,갤럭시 원클릭 20mm
원클릭 날개형 가죽 스트랩,갤럭시 원클릭 20mm,가죽,20mm,원클릭,,,갤럭시 원클릭 20mm
원클릭 날개형 싱글 투어 레더 스트랩,갤럭시 원클릭 20mm,가죽,20mm,원클릭,,,갤럭시 원클릭 20mm
원클릭 날개형 디버클 슬림 레더 스트랩,갤럭시 원클릭 20mm,가죽,20mm,디버클(마그네틱),,,갤럭시 원클릭 20mm
원클릭 날개형 빈티지 가죽 스트랩,갤럭시 원클릭 20mm,가죽,20mm,원클릭,,,갤럭시 원클릭 20mm
원클릭 날개형 알파핏 실리콘 스트랩 (소진 시 단종 예정),갤럭시 원클릭 20mm,실리콘,20mm,원클릭,,,갤럭시 원클릭 20mm
원클릭 날개형 스포츠 실리콘 스트랩 (알파핏 보강품),갤럭시 원클릭 20mm,실리콘,20mm,원클릭,"블랙,실버, 다크그레이, 미드나잇블루, 스타라이트, 샌드핑크,피크닉민트, 옐로우,라이트퍼플",,갤럭시 원클릭 20mm
원클릭 날개형 다이나믹 실리콘 스트랩,갤럭시 원클릭 20mm,실리콘,20mm,원클릭,,,갤럭시 원클릭 20mm
원클릭 날개형 웨이브 스티치 실리콘 스트랩 20mm (*참고: 스트릿 엣지 디자인),갤럭시 원클릭 20mm,실리콘,20mm,원클릭,,,갤럭시 원클릭 20mm
원클릭 날개형 코도반 레더 가죽 스트랩,갤럭시 원클릭 20mm,가죽,20mm,원클릭,,,갤럭시 원클릭 20mm
스틸 스트랩,미밴드10/ 9 / 8,메탈,퀵릴리즈,,"블랙,실버 [추가컬러] 딥그레이, 골드,로즈골드,로즈핑크,스타라이트",images/16_2.jpg,미밴드10/ 9 / 8
메탈 스트랩,미밴드10/ 9 / 8,메탈,퀵릴리즈,,"블랙,실버,로즈골드",images/16_3.jpg,미밴드10/ 9 / 8
프리미엄 메탈 스트랩,미밴드10/ 9 / 8,메탈,퀵릴리즈,,"블랙, 실버, 골드, 로즈골드, 로즈핑크,샌드핑크, 라벤더, 레인보우, 딥그레이, 스타라이트, 스타라이트블루, 스타라이트그린, 로즈핑크퍼플, 민트코랄 🟩추가 등록 세라믹블루,,화이트,애쉬화이트",images/16_4.jpg,미밴드10/ 9 / 8
체인 브레이슬릿 메탈 스트랩,미밴드10/ 9 / 8,메탈,퀵릴리즈,,"블랙,실버,로즈골드,로즈핑크,스타라이트",images/16_5.jpg,미밴드10/ 9 / 8
비건 레더 싱글 체인 메탈 스트랩,미밴드10/ 9 / 8,가죽,퀵릴리즈,,블랙+블랙 실버+블랙 로즈골드+화이트 실버+화이트 *실버+베리핑크 *로즈골드+베리핑크,images/16_6.jpg,미밴드10/ 9 / 8
일체형 투명 범퍼 케이스 밀레니즈 메탈 스트랩,미밴드10/ 9 / 8,메탈,일체형 메탈,일체형,-,images/16_7.jpg,미밴드10/ 9 / 8
후크 패브릭 나일론 스트랩,미밴드10/ 9 / 8,패브릭,퀵릴리즈,,"블랙, 샌드화이트, 오렌지, 카키,베이지,크레용,",,미밴드10/ 9 / 8
풀탭 스포츠루프 밸크로 패브릭 나일론 스트랩,미밴드10/ 9 / 8,패브릭,퀵릴리즈,벨크로,"블랙(리플렉티드블랙),포그그레이, 라이트그린, 파파야, 펄핑크, 민트, 로즈레드,네온핑크,밀크화이트, 팬텀실버,딥씨블루,블루카키, 메이지핑크, 메이지옐로우,애플민트, 커피브라운, 세레니티블루, 카모그린",images/16_9.jpg,미밴드10/ 9 / 8
*Air Slope 에어 슬로프 밸크로 패브릭 나일론 스트랩,미밴드10/ 9 / 8,패브릭,퀵릴리즈,,"블랙,실버,미드나잇블루 블루,핑크,오렌지 샌드핑크,스카이,라벤더 버건디,카키,올리브 스타라이트",images/16_10.jpg,미밴드10/ 9 / 8
모노 스포츠루프 스트랩,미밴드10/ 9 / 8,패브릭,퀵릴리즈,스포츠루프,"블랙, 스페이스블랙, 네온라임, 미드나잇블루, 알래스칸블루, 샌드핑크, 베이비핑크, 실버화이트, 레인보우, 레인보우B, 레드블랙, 비비드핑크, 케이프블루, 다크그린, 피스타치오, 비타민오렌지, 라임, 민트, 퍼플, 파파야",images/16_11.jpg,미밴드10/ 9 / 8
모노 스포츠루프 스트랩 2P 세트 [블랙+00*],미밴드10/ 9 / 8,패브릭,퀵릴리즈,스포츠루프,"블랙 + 스페이스블랙 블랙 + 네온라임 블랙 + 미드나잇블루 블랙 + 알래스칸블루, 블랙 + 샌드핑크 블랙 + 베이비핑크 블랙 + 실버화이트 블랙 + 레인보우 블랙 + 레인보우B 블랙 + 레드블랙 블랙 + 비비드핑크 블랙 + 케이프블루 블랙 + 다크그린 블랙 + 피스타치오 블랙 + 비타민오렌지 블랙 + 라임 블랙 + 민트 블랙 + 퍼플 블랙 + 파파야",images/16_12.jpg,미밴드10/ 9 / 8
프리미엄 모노 스포츠루프 스트랩,미밴드10/ 9 / 8,패브릭,퀵릴리즈,스포츠루프,"블랙, 실버화이트, 네이비핑크, 스톰그레이, 세레니티블루, 리플렉티드블랙, 네온핑크, 히비스커스, 밀크화이트, 펄핑크, 로즈레드, 케이프블루, 파파야, 메이지옐로우, 메이지핑크, 블루카키, 레인보우B 라이트그린, 오렌지, 포그그레이,투톤그린, 투톤실버,커피브라운,투톤딥블루,카모그린 세이지민트",images/16_13.jpg,미밴드10/ 9 / 8
브레이드 솔로 루프 밴드 스트랩 (3사이즈),미밴드10/ 9 / 8,패브릭,퀵릴리즈,일체형,"블랙, 레드, 블루, 카키, 핑크, 스타라이트블랙, 샤이닝블랙, 인디고, 레인보우",images/16_14.jpg,미밴드10/ 9 / 8
프리미엄 마그네틱 브레이드 스트랩,미밴드10/ 9 / 8,패브릭,퀵릴리즈,마그네틱,"블랙, 딥그레이, 스타라이트블랙, 샌드핑크, 베이비핑크, 스타라이트, 오렌지, 카키, 레드블랙, 화이트핑크, 화이트블랙, 샤이닝블랙, 레인보우, 레인보우B, 레인보우블랙, 인디고 ★라이트버건디,★샌드버건디,★샌드그린",images/16_15.jpg,미밴드10/ 9 / 8
마그네틱 브레이드 스트랩,미밴드10/ 9 / 8,패브릭,퀵릴리즈,마그네틱,"블랙,스타라이트,스타포인트,체리블러썸,라이트버건디,다크그린,스타라이트블랙,샤이닝블랙,레인보우,인디고",images/16_16.jpg,미밴드10/ 9 / 8
스트래치 나일론 스트랩,미밴드10/ 9 / 8,패브릭,퀵릴리즈,,"블랙,미드나잇블루,다크그레이, 스타라이트, 라즈베리,버건디, 코코아, 카키,에메랄드그린 핑크, 스카이, 화이트",images/16_17.jpg,미밴드10/ 9 / 8
